{
  "$schema": "http://json-schema.org/draft-07/schema#",
  "type": "array",
  "items": {
    "type": "object",
    "required": ["id","titulo"],
    "properties": {
      "id": {"type":"string"},
      "titulo": {"type":"string"},
      "precio_base": {"type":"string"},
      "descripcion": {"type":"string"}
    },
    "additionalProperties": false
  }
}
